{
  "id": "prLSlfYXlQ8Nmsa8gyVi6PPZUmA=",
  "partitionkey": "{10.0.0.28:8081 -> 10.0.0.2:65473}",
  "source": "ctd.mbta.com/trike-1234",
  "specversion": "1.0",
  "time": "2023-01-29T13:51:54.990000Z",
  "type": "com.mbta.ocs.tsch_new.v1",
  "data": {
    "counter": 70877,
    "timestamp": "2025-06-02T18:45:43.958582-04:00",
    "transitLine": "B",
    "tripUid": "98BB3A47",
    "addType": "A",
    "tripType": "A",
    "scheduledDepartureTime": "2025-06-02T18:45:00-04:00",
    "scheduledArrivalTime": "2025-06-02T19:00:00-04:00",
    "ocsRouteId": "rad",
    "originStation": "ORIENT HEIGHTS",
    "destinationStation": "BOWDOIN",
    "previousTripUid": null,
    "nextTripUid": null
  }
}
